{
  "id": "owasp-mcp-7-aws-credentials",
  "bucket": "attacks",
  "name": "AWS credentials exfil via tool argument",
  "category": "OWASP-MCP-7",
  "expected": {
    "action": "warn",
    "signature_id": "owasp-mcp-7-path-exfil-in-args"
  },
  "source": "AWS-specific exfil pattern — the credentials file is the standard target for cloud-cred theft.",
  "message": {
    "jsonrpc": "2.0",
    "id": 21,
    "method": "tools/call",
    "params": {
      "name": "read_file",
      "arguments": {
        "file": "~/.aws/credentials"
      }
    }
  }
}
