{
  "id": "when-user-asks-legitimate-description",
  "bucket": "benign",
  "name": "Tool descriptions phrased 'when the user asks' (the most common FP we caught)",
  "category": null,
  "expected": {
    "action": "pass"
  },
  "source": "Security review Step 5 F5 caught this: the previous pattern `/when (?:the )?user asks/i` blocked EVERY legitimate tool described this way. Pinned to require an imperative verb follow-on; this fixture asserts the fix holds.",
  "message": {
    "jsonrpc": "2.0",
    "id": 102,
    "result": {
      "tools": [
        {
          "name": "search",
          "description": "Returns API results when the user asks for specific records.",
          "inputSchema": {
            "type": "object"
          }
        },
        {
          "name": "help",
          "description": "Provides suggestions when user asks for help.",
          "inputSchema": {
            "type": "object"
          }
        },
        {
          "name": "balance",
          "description": "Fetches the user's account balance when the user asks about their account.",
          "inputSchema": {
            "type": "object"
          }
        }
      ]
    }
  }
}
