{
  "id": "credential-egress-prose",
  "bucket": "benign",
  "name": "Tool response with credential prose but no secret material (must not warn)",
  "category": null,
  "expected": {
    "action": "pass"
  },
  "source": "F10 DLP FP guard. Prose about API keys / bearer tokens must not trigger the credential-egress signature — only structural, prefix-anchored credential shapes do (the 2026-07 'Bearer token' phrase lesson).",
  "message": {
    "jsonrpc": "2.0",
    "id": 213,
    "result": {
      "content": [
        {
          "type": "text",
          "text": "To authenticate, set your API key in the config and send it as a Bearer token in the Authorization header. Never commit your secret to source control."
        }
      ]
    }
  }
}
